<?xml version="1.0" encoding="UTF-8"?>
<xs:schema xmlns:xs="http://www.w3.org/2001/XMLSchema">
	<xs:element name="person">
		<xs:complexType>
			<xs:sequence>
				<xs:element name="full_name" type="xs:string"/>
				<xs:element name="child_name" type="xs:string" maxOccurs="unbounded"/>
			</xs:sequence>
		</xs:complexType>
	</xs:element>
</xs:schema>