<?xml version="1.0" encoding="UTF-8"?>
<person xmlns:xsi="http://www.w3.org/2001/XMLSchema-instance"
xsi:noNamespaceSchemaLocation="Ejercicio2.xsd">
    <full_name>Hege Refsnes</full_name>
    <child_name>Cecilie</child_name>
</person>
<person xmlns:xsi="http://www.w3.org/2001/XMLSchema-instance"
xsi:noNamespaceSchemaLocation="Ejercicio2.xsd">
    <full_name>Tove Refsnes</full_name>
    <child_name>Hege</child_name>
    <child_name>Stale</child_name>
    <child_name>Jim</child_name>
    <child_name>Borge</child_name>
</person>
<person xmlns:xsi="http://www.w3.org/2001/XMLSchema-instance"
xsi:noNamespaceSchemaLocation="Ejercicio2.xsd">
  <full_name>Stale Refsnes</full_name>
  <child_name>Android</child_name>
</person>